{
  "event_id": "11111111-1111-4111-8111-111111111111",
  "schema_id": "physical-assignment.installed/v0",
  "stream_id": "22222222-2222-4222-8222-222222222222",
  "stream_sequence": "8",
  "authority_epoch": "00000000000000000000000000000001",
  "aggregate_type": "PhysicalAssignment",
  "aggregate_id": "33333333-3333-4333-8333-333333333333",
  "aggregate_revision": "8",
  "command_id": "44444444-4444-4444-8444-444444444444",
  "actor_id": "user.a2-1",
  "capture_epoch": "55555555-5555-4555-8555-555555555555",
  "capture_frame": "2304000",
  "effective_utc": "2026-09-19T12:00:00Z",
  "uncertainty_ms": 0,
  "recorded_utc": "2026-09-19T12:00:00.010Z",
  "payload": {"state": "installed-unverified"},
  "payload_hash": "aaaaaaaaaaaaaaaaaaaaaaaaaaaaaaaaaaaaaaaaaaaaaaaaaaaaaaaaaaaaaaaa",
  "previous_event_hash": "bbbbbbbbbbbbbbbbbbbbbbbbbbbbbbbbbbbbbbbbbbbbbbbbbbbbbbbbbbbbbbbb"
}
